title,pubdate,date_collected,url,summary,keywords,FullText
Taco Bell expands beverage menu with 6 new sips for summer,,2025-07-17 13:43:59.926109,https://abcnews.go.com/GMA/Food/taco-bell-mocktails-refrescas-summer/story?id=123774145,"Taco Bell launches Refrescas as new premium beverage optionTaco Bell launched a new Refrescas drink lineup for a premium beverage offering.
Taco Bell launched a new Refrescas drink lineup for a premium beverage offering.
What to know about new Taco Bell Live Más Café locationsTaco Bell also confirmed to ""Good Morning America"" the expansion of the brand's innovative beverage concept, Live Más Café, with 30 new locations set to open across Southern California and Texas by fall 2025.
""Live Más Café is reinventing the Taco Bell experience with expertly trained 'Bellristas' who handcraft the specialty drinks on the spot as part of the elevated in-restaurant atmosphere.""
""This is just the beginning of a multi-year beverage transformation, and Taco Bell is making one thing clear: bold refreshment is officially on the menu,"" it added.","['summer', 'expands', 'menu', 'live', 'refrescas', 'sips', 'bell', 'company', 'premium', 'drinks', 'lineup', 'taco', 'más', 'beverage']","Here's what to know about the new drinks menu.

Taco Bell is leaning into liquids that go beyond Mountain Dew Baja Blast with the addition of new Refrescas to its beverage menu that the fast food chain hopes will quench every kind of craving.

The Irvine, California-based quick service restaurant, owned by Yum! Brands, announced new permanent menu items last month in an attempt to make its drinks as iconic as its food offerings.

The company said its goal is to reach $5 billion in beverage sales by 2030.

""We're seeing today that people, especially younger consumers, are reaching for refreshing drinks as part of their lifestyle, whether it's for energy or a sweet treat throughout the day,"" Liz Matthews, Taco Bell's global chief food innovation officer, said in a statement. ""So we're making big investments to become the ultimate beverage stop where our fans can expect to see the same bold, unexpected creativity in their cups as they do on their plates.""

Taco Bell launches Refrescas as new premium beverage option

Taco Bell launched a new Refrescas drink lineup for a premium beverage offering. Taco Bell

""Taco Bell's all-new Refrescas lineup features six drinks crafted to deliver a variety of flavors and functions matching any mood, meal, or moment: three thirst-quenching refreshers, two electrifying energy drinks, and a cooling Freeze,"" the company said in a press release. ""The three Agua Refrescas join menus permanently after initially being tested in Southern California in 2024, with positive response proving fan cravings for premium beverages that pair perfectly with Taco Bell favorites.""

The newly launched six-drink lineup features the following options:

Agua Refrescas



Taco Bell's twist on the Mexican beverage agua fresca gets mixed with real freeze-dried fruit pieces and green tea to provide a subtle boost of caffeine -- 52 mg per beverage. The drinks are available in Strawberry Passionfruit, Dragonfruit Berry, and Mango Peach flavors and cost $3.99 for a 20-ounce size.

Rockstar Energy Refrescas



Fans can get a boost of caffeine in a Pineapple Lime or Tropical Punch Rockstar Energy Refresca, flavors the company said ""were curated exclusively for Taco Bell.""

The drinks contain 200 mg of caffeine and cost $4.49 for a 20-ounce size.

Taco Bell launched a new Refrescas drink lineup for a premium beverage offering. Taco Bell

Refresca Freeze



The Refresca Freeze is a frozen take on the Refresca lineup. It features freeze-dried fruit and transforms the Strawberry Lime flavor ""for maximum cool down,"" the company said.

It comes in two sizes, 16-ounce and 20-ounce, for $3.79 and $3.99, respectively.

What to know about new Taco Bell Live Más Café locations

Taco Bell also confirmed to ""Good Morning America"" the expansion of the brand's innovative beverage concept, Live Más Café, with 30 new locations set to open across Southern California and Texas by fall 2025.

""Inspired by Gen Z's love for curated, customizable drinks, the [Live Más Café] concept offers over 30 signature beverages, from Churro Chillers and specialty coffees to Refrescas and Dirty Mountain Dew Baja Blast Dream Sodas,"" the company stated. ""Live Más Café is reinventing the Taco Bell experience with expertly trained 'Bellristas' who handcraft the specialty drinks on the spot as part of the elevated in-restaurant atmosphere.""

""This is just the beginning of a multi-year beverage transformation, and Taco Bell is making one thing clear: bold refreshment is officially on the menu,"" it added."
Value mini taco salad and churros being tested at Taco Bell in Indianapolis,07/17/2025,2025-07-17 13:43:59.926109,https://www.indystar.com/story/entertainment/dining/restaurants/2025/07/17/taco-bell-luxe-value-menu-test-indiana-prices-new-items-being-tested-mini-taco-salad/85258579007/,"Mini Taco Salad – Featuring seasoned beef, Chipotle Sauce, cheddar cheese, lettuce, tomatoes and refried beans in a crispy, golden tortilla bowl.
$2.49– Featuring seasoned beef, Chipotle Sauce, cheddar cheese, lettuce, tomatoes and refried beans in a crispy, golden tortilla bowl.
$2.99– Grilled all-white-meat chicken, double sauces (Avocado Ranch Sauce and Chipotle Sauce), three-cheese blend, lettuce and tomatoes all folded into Taco Bell’s signature Stacker format.
$2.99 Beefy Potato Loaded Griller – A grilled roll-up filled with seasoned beef, crispy potato bites, Nacho Cheese Sauce, Chipotle Sauce and reduced-fat sour cream.
$2.49– A grilled roll-up filled with seasoned beef, crispy potato bites, Nacho Cheese Sauce, Chipotle Sauce and reduced-fat sour cream.","['beef', 'threecheese', '249', 'value', 'bell', 'chipotle', 'mini', 'salad', 'indianapolis', 'sauce', 'seasoned', 'nacho', 'cheese', 'taco', 'churros', 'tested']","Indianapolis is getting a first look at potential Taco Bell value items.

The market is the exclusive testing ground of the fast food chain's Luxe Value Menu, including its Mini Taco Salad.

All the items are priced at under $3.

What's on Taco Bell's Luxe Value Menu?

Items include:

Need a break? Play the USA TODAY Daily Crossword Puzzle.

Mini Taco Salad – Featuring seasoned beef, Chipotle Sauce, cheddar cheese, lettuce, tomatoes and refried beans in a crispy, golden tortilla bowl. $2.49

– Featuring seasoned beef, Chipotle Sauce, cheddar cheese, lettuce, tomatoes and refried beans in a crispy, golden tortilla bowl. $2.49 Chipotle Ranch Chicken Stacker – Grilled all-white-meat chicken, double sauces (Avocado Ranch Sauce and Chipotle Sauce), three-cheese blend, lettuce and tomatoes all folded into Taco Bell’s signature Stacker format. $2.99

– Grilled all-white-meat chicken, double sauces (Avocado Ranch Sauce and Chipotle Sauce), three-cheese blend, lettuce and tomatoes all folded into Taco Bell’s signature Stacker format. $2.99 Beefy Potato Loaded Griller – A grilled roll-up filled with seasoned beef, crispy potato bites, Nacho Cheese Sauce, Chipotle Sauce and reduced-fat sour cream. $2.49

– A grilled roll-up filled with seasoned beef, crispy potato bites, Nacho Cheese Sauce, Chipotle Sauce and reduced-fat sour cream. $2.49 Chips & Nacho Supreme Dip – Layers of seasoned beef, beans, Nacho Cheese Sauce, reduced-fat sour cream, pico de gallo, and a three-cheese blend. Served with tortilla chips. $2.49

– Layers of seasoned beef, beans, Nacho Cheese Sauce, reduced-fat sour cream, pico de gallo, and a three-cheese blend. Served with tortilla chips. $2.49 Salted Caramel Churros – A three-pack of churros dusted in salted caramel sugar. $1.99

Brand representatives would not say how long the items would be available.

The items appear alongside Taco Bell’s original Cravings Value Menu that includes the Cheesy Roll Up, Spicy Potato Soft Taco, Cheesy Bean & Rice Burrito, Three-Cheese Chicken Flatbread and the Cheesy Double Beef Burrito.

Contact Midwest Connect reporter Cheryl V. Jackson at cjackson@gannett.com or 317-444-6264. Follow her on X.com: @cherylvjackson or Bluesky: @cherylvjackson.bsky.social."
Taco Bell Introduces New Sweet Chipotle Bbq Sauce,07/17/2025,2025-07-17 13:43:59.926109,https://rutherfordsource.com/taco-bell-introduces-new-sweet-chipotle-bbq-sauce/,"The Lineup:Crispy Chicken Taco ft. Spicy Ranch and all-new Sweet Chipotle BBQ Sauce: One perfectly crisped Crispy Chicken Strip layered with purple cabbage, crisp lettuce, Spicy Ranch sauce, pico de gallo and shredded cheddar cheese, paired with the all-new Sweet Chipotle BBQ for $2.79*.
Crispy Chicken Burrito ft. Spicy Ranch and all-new Sweet Chipotle BBQ Sauce: Two Crispy Chicken Strips surrounded by purple cabbage, crisp lettuce, Spicy Ranch sauce, pico de gallo and shredded cheddar cheese, paired with the all-new Sweet Chipotle BBQ and wrapped tight into a burrito for $5.49*.
Sweet Chipotle BBQ Sauce Topped Fries: Nacho Fries but with a sweet heat twist!
Atop a base of golden Nacho Fries is slow-roasted chicken, a drizzling of Nacho Cheese sauce, Spicy Ranch, the all-new Sweet Chipotle BBQ sauce, cheddar cheese and jalapeños all for $4.99*.
As Taco Bell continues to invest in redefining crispy chicken for its fans, the Sweet Chipotle BBQ sauce represents more than just a new sauce — it’s a flavorful leap forward in an already loaded chicken playbook.","['ranch', 'crispy', 'chipotle', 'bell', 'sauce', 'bbq', 'sweet', 'spicy', 'cheese', 'taco', 'introduces', 'chicken']","(July 16, 2025) – Taco Bell is taking things to the next level this summer with its nationwide debut of a Sweet Chipotle BBQ sauce, a limited-time flavor created as the next perfect pairing for its popular Crispy Chicken menu. Available starting July 17, the new sauce balances smoky chipotle peppers, sweet molasses and spices – the ultimate match for tortilla chip-coated Crispy Chicken Tacos, Burritos and Strips.

Why BBQ? Why Now?

BBQ ranks among the most-loved dipping sauces in the crispy chicken space, and while Taco Bell has dabbled in the BBQ world before, this version brings a fresh, Taco Bell-style twist. Inspired by the flavors that drive summer cravings: think backyard BBQ meets fiery heat. Whether it’s drizzled inside a Crispy Chicken Taco or Burrito, paired with Strips or atop crispy Nacho Fries, this sauce is set to become a summer obsession.

Another Craveable Layer to Crispy Chicken’s Success

Since the April comeback of Crispy Chicken Nuggets and the June expansion of Crispy Chicken Tacos and Burritos, fans haven’t stopped craving Taco Bell’s take on crispy. In fact, crispy chicken now appears in roughly 1 in every 10 orders and over 20 million sauces have been sold since the relaunch, proving that fans are down to get saucy.

The Lineup:

Crispy Chicken Taco ft. Spicy Ranch and all-new Sweet Chipotle BBQ Sauce: One perfectly crisped Crispy Chicken Strip layered with purple cabbage, crisp lettuce, Spicy Ranch sauce, pico de gallo and shredded cheddar cheese, paired with the all-new Sweet Chipotle BBQ for $2.79*. Creamy, mild ranch lovers can opt for Avocado Ranch as their sauce of choice.

One perfectly crisped Crispy Chicken Strip layered with purple cabbage, crisp lettuce, Spicy Ranch sauce, pico de gallo and shredded cheddar cheese, paired with the all-new Sweet Chipotle BBQ for $2.79*. Crispy Chicken Burrito ft. Spicy Ranch and all-new Sweet Chipotle BBQ Sauce: Two Crispy Chicken Strips surrounded by purple cabbage, crisp lettuce, Spicy Ranch sauce, pico de gallo and shredded cheddar cheese, paired with the all-new Sweet Chipotle BBQ and wrapped tight into a burrito for $5.49*. Creamy, mild ranch lovers can opt for Avocado Ranch as their sauce of choice.

Two Crispy Chicken Strips surrounded by purple cabbage, crisp lettuce, Spicy Ranch sauce, pico de gallo and shredded cheddar cheese, paired with the all-new Sweet Chipotle BBQ and wrapped tight into a burrito for $5.49*. Sweet Chipotle BBQ Sauce Topped Fries: Nacho Fries but with a sweet heat twist! Atop a base of golden Nacho Fries is slow-roasted chicken, a drizzling of Nacho Cheese sauce, Spicy Ranch, the all-new Sweet Chipotle BBQ sauce, cheddar cheese and jalapeños all for $4.99*.

Nacho Fries but with a sweet heat twist! Atop a base of golden Nacho Fries is slow-roasted chicken, a drizzling of Nacho Cheese sauce, Spicy Ranch, the all-new Sweet Chipotle BBQ sauce, cheddar cheese and jalapeños all for $4.99*. Sweet Chipotle BBQ Sauce on ANY Fan Favorites:The iconic new sauce will be available to add to any menu item for $0.30 or on the side in a souffle cup for $0.60*, including the fan favorite Crispy Chicken Strips or legendary Nacho Fries.

As Taco Bell continues to invest in redefining crispy chicken for its fans, the Sweet Chipotle BBQ sauce represents more than just a new sauce — it’s a flavorful leap forward in an already loaded chicken playbook.

Source: Taco Bell

More Eat & Drink

Please Join Our FREE Newsletter! Email"
Taco Bell using Indy as Test Market,07/17/2025,2025-07-17 13:43:59.926109,https://wibc.com/680339/taco-bell-using-indy-as-test-market/,"The new items include:Mini Taco Salad with beef, beans, cheese, lettuce, tomato, and chipotle sauce in a crispy tortilla bowl.
with beef, beans, cheese, lettuce, tomato, and chipotle sauce in a crispy tortilla bowl.
Chipotle Ranch Chicken Stacker , a folded wrap with grilled chicken, ranch, chipotle sauce, cheese, lettuce, and tomato.
Beefy Potato Loaded Griller , filled with beef, potatoes, cheese, chipotle sauce, and sour cream.
Chips & Nacho Supreme Dip , a scoopable snack with beef, beans, cheese, sour cream, and pico de gallo.","['indy', 'beef', 'sour', 'lettuce', 'menu', 'bell', 'chipotle', 'market', 'sauce', 'cream', 'tomato', 'using', 'cheese', 'taco', 'test', 'chicken']","Source: Jeff Greenberg / Getty

Taco Bell is spicing things up in Indianapolis with a brand-new value menu hitting stores July 17. Called the Luxe Value Menu, it features five items priced at $3 or less. These are premium versions of past or current favorites.

The new items include:

Mini Taco Salad with beef, beans, cheese, lettuce, tomato, and chipotle sauce in a crispy tortilla bowl.

with beef, beans, cheese, lettuce, tomato, and chipotle sauce in a crispy tortilla bowl. Chipotle Ranch Chicken Stacker , a folded wrap with grilled chicken, ranch, chipotle sauce, cheese, lettuce, and tomato.

, a folded wrap with grilled chicken, ranch, chipotle sauce, cheese, lettuce, and tomato. Beefy Potato Loaded Griller , filled with beef, potatoes, cheese, chipotle sauce, and sour cream.

, filled with beef, potatoes, cheese, chipotle sauce, and sour cream. Chips & Nacho Supreme Dip , a scoopable snack with beef, beans, cheese, sour cream, and pico de gallo.

, a scoopable snack with beef, beans, cheese, sour cream, and pico de gallo. Salted Caramel Churros, crispy churros filled with cream and dusted in caramel sugar.

This test follows past Midwest trials, like chicken nuggets in 2023 and street chalupas in 2024. Taco Bell hopes the Luxe menu adds value while offering a premium feel.

The menu is only in Indianapolis for now. But it may expand if customers respond well.

SEE ALSO Grizzlies Trade Center Jay Huff to Pacers"
Taco Bell Is Launching Sweet Chipotle BBQ Crispy Chicken — and Other New Menu Items,,2025-07-17 13:43:59.926109,https://people.com/taco-bell-is-launching-sweet-chipotle-bbq-crispy-chicken-and-other-new-menu-items-11774308,"The chain’s Nacho Fries and Crispy Chicken Tacos and Burritos are getting a saucy twist thanks to the brand-new Sweet Chipotle BBQ Sauce.
Sweet Chipotle BBQ Sauce Topped Fries are another option for trying the new sauce.
While fans everywhere can get their hands on the barbecue-coated and dulce de leche-filled menu items, there are some menu items being tested in select cities.
Taco Bell's Tajín Taco.
Taco Bell is testing a Luxe Value Menu with brand-new $3-and-under items, including the Chipotle Ranch Chicken Stacker, Beefy Potato Loaded Griller, Chips & Nacho Supreme Dip, Mini Taco Salad and Salted Caramel Churros.","['ranch', 'launching', 'menu', 'crispy', 'tajín', 'chipotle', 'bell', 'bbq', 'sauce', 'sweet', 'items', 'luxe', 'taco', 'chicken']","NEED TO KNOW Taco Bell launched Sweet Chipotle BBQ Sauce nationwide on July 17, along with several menu items that feature the new condiment

Dulce de Leche Cinnabon Delights are another new addition to menus across the country

Select locations in Ohio and Indiana are testing Tajín-spiced items and new Luxe Value Menu choices

Taco Bell has new sauces, sweets and surprising collabs this July.

The Mexican fast food spot revealed in a press release shared on Thursday, July 17, that it has new menu items nationwide, and some for a few lucky locations.

The chain’s Nacho Fries and Crispy Chicken Tacos and Burritos are getting a saucy twist thanks to the brand-new Sweet Chipotle BBQ Sauce. The latest condiment, described on the restaurant’s website as tasting sweet, tangy and smoky with chipotle peppers and other spices, is available for customers to add to any order and highlighted in three particular menu items.

Taco Bell’s Crispy Chicken Tacos ($2.80) and Burritos ($5.50) launched in mid-June as tortilla-chip crusted chicken strips stuffed with cabbage, lettuce, shredded cheddar, pico de gallo, but now they come with a choice of Avocado Ranch Sauce or Sweet Chipotle BBQ Sauce. Previously, the wraps came with the choice of Avocado Ranch Sauce or Spicy Ranchero Sauce.

Sweet Chipotle BBQ Sauce Topped Fries are another option for trying the new sauce. Nacho Fries get topped with chicken, cheese sauce, cheddar cheese, jalapeños, Spicy Ranch and the latest condiment in the $5 drop.

While the new sauce and subsequent menu items are available starting July 17, customers can expect a new sweet treat later this month.

Taco Bell's Dulce de Leche Cinnabon Delights. Taco Bell

Dulce de Leche Cinnabon Delights are the newest addition to Taco Bell’s partnership with the mall food court favorite.

In this new dessert offering, doughnut holes get a dulce de leche filling before being rolled in salted caramel sugar. They are available starting on Thursday, July 31, for a limited time.

While fans everywhere can get their hands on the barbecue-coated and dulce de leche-filled menu items, there are some menu items being tested in select cities.

Taco Bell's Tajín Taco. Taco Bell

Customers in Columbus can try the Tajín Taco for $2.50. A hard shell taco is coated in Tajín, the popular spice blend of chili peppers, lime and sea salt, and filled with beef, ranch, lettuce, cheddar cheese and mango pico de gallo salsa. Plus, each order comes with an extra packet of Tajín Chile Lime seasoning.

The Tajín Taco can be ordered à la carte or part of a special $9 Discovery Luxe Box.

Some Indianapolis locations have their own Luxe Value Menu starting on July 17.

Taco Bell is testing a Luxe Value Menu with brand-new $3-and-under items, including the Chipotle Ranch Chicken Stacker, Beefy Potato Loaded Griller, Chips & Nacho Supreme Dip, Mini Taco Salad and Salted Caramel Churros. The menu also includes fan-favorite items like the Cheesy Roll Up, Spicy Potato Soft Taco, Cheesy Bean & Rice Burrito, Three-Cheese Chicken Flatbread and Cheesy Double Beef Burrito."
Taco Bell expands beverage menu with 6 new sips for summer,,2025-07-17 13:43:59.926109,https://www.goodmorningamerica.com/food/story/taco-bell-mocktails-refrescas-summer-123774145,,"['summer', 'expands', 'menu', 'sips', 'bell', 'taco', 'beverage']",
Taco Bell Is Putting New Mocktails on the Menu This Summer,07/15/2025,2025-07-17 13:43:59.926109,https://www.today.com/food/drinks/taco-bell-new-mocktails-rcna218854,"Wash your next Taco Bell feast down with one of the chain’s new pick-me-ups.
Taco Bell is offering six varieties in total; three are permanent additions, and three are limited-edition items:Agua Refrescas ($3.99): These permanent 20-ounce drinks are available in Strawberry Passionfruit, Dragonfruit Berry and Mango Peach flavors.
These permanent 20-ounce drinks are available in Strawberry Passionfruit, Dragonfruit Berry and Mango Peach flavors.
These limited-edition 20-ounce drinks are available in Pineapple Lime or Tropical Punch Rockstar Energy flavors and have 200 milligrams of caffeine each.
Though it’s being rebranded as “mocktails” or “Refreshers” by restaurant chains, the drink has been around since the Aztec Empire.","['summer', 'milligrams', 'menu', '20ounce', 'mocktails', 'refrescas', 'bell', 'limitededition', 'drinks', 'putting', 'caffeine', 'available', 'strawberry', 'taco', 'flavors']","Wash your next Taco Bell feast down with one of the chain’s new pick-me-ups.

On June 17, the Tex Mex-inspired chain added Refrescas to its menus nationwide. While many have been calling them “mocktails” because they’re nonalcoholic, they’re a new version of the Mexican aguas frescas that were first tested in Southern California in 2024.

Taco Bell is offering six varieties in total; three are permanent additions, and three are limited-edition items:

Agua Refrescas ($3.99): These permanent 20-ounce drinks are available in Strawberry Passionfruit, Dragonfruit Berry and Mango Peach flavors. They contain freeze-dried fruit pieces, green tea and 52 milligrams of caffeine each.

These permanent 20-ounce drinks are available in Strawberry Passionfruit, Dragonfruit Berry and Mango Peach flavors. They contain freeze-dried fruit pieces, green tea and 52 milligrams of caffeine each. Rockstar Energy Refrescas ($4.49): These limited-edition 20-ounce drinks are available in Pineapple Lime or Tropical Punch Rockstar Energy flavors and have 200 milligrams of caffeine each.

These limited-edition 20-ounce drinks are available in Pineapple Lime or Tropical Punch Rockstar Energy flavors and have 200 milligrams of caffeine each. Refresca Freeze ($3.79/$3.99): This limited-edition 16-ounce or 20-ounce drink features freeze-dried fruit pieces, is Strawberry Lime-flavored and contains no caffeine.

Taco Bell's six new Refrescas. Taco Bell

Aline N., brand manager of beverages, said in a press release that the new drinks take inspiration from aguas frescas, a popular beverage in Mexico and Latin America.

Liz Matthews, Taco Bell’s global chief food innovation officer, said in another release that the chain is “making big investments” to make its drinks as beloved as its food.

As part of this investment, it will open 30 more new Live Más Cafés — its drinks-focused spinoff restaurant — inside of existing Taco Bell restaurants starting in Southern California, Dallas and Houston, Texas by the end of 2025.

Agua fresca translates to “fresh water” and involves blending fresh fruits, vegetables, rice or hibiscus with water and straining. Though it’s being rebranded as “mocktails” or “Refreshers” by restaurant chains, the drink has been around since the Aztec Empire."
