title,pubdate,date_collected,url,summary,keywords,FullText
Not just McDonald's: Here's where else you can get chicken wraps,07/11/2025,2025-07-17 13:43:59.926109,https://www.freep.com/story/money/food/2025/07/11/mcdonalds-popeyes-burger-king-taco-bell-chicken-wraps/84567073007/,"While the tizzy continues around the Golden Arches' comeback, here's a look at some other fast-food chains that sell chicken wraps.
Sonic Crispy Tender WrapsSonic is another chain that recently introduced chicken wraps to its menu.
Flavors: Cheesy Baja Crispy Tender Wrap and Honey Chipotle Crispy Tender Wrapand Cost: $1.99Sonic also told USA TODAY more wrap flavors are coming later this year.
Taco Bell crispy chicken tacos and burritos (AKA wraps)Earlier this summer, Taco Bell debuted a new lineup of crispy chicken menu items that include tacos and burritos after a successful trial with chicken nuggets.
Customers can choose between a grilled chicken, spicy chicken or classic chicken wrap duo.","['ranch', 'lettuce', 'menu', 'mcdonalds', 'crispy', 'wrap', 'wraps', 'spicy', 'cheese', 'heres', 'tender', 'chicken']","McDonald's beloved Snack Wrap has some competition.

The chicken wrap, which returned to McDonald's menus on July 10 nearly a decade after the item was phased out, has sparked a wrap war: some fast-food chains, like Burger King, are reminding fans they've had wraps for years, and others, like Popeyes and Taco Bell, recently added their own versions to their menus.

McDonald's wrap, available a la carte or in a combo meal, is available in two flavors: spicy and ranch. The combo meal comes with two Snack Wraps, a medium fry and a drink of choice. If you're only ordering the wrap, the item costs $2.99 each.

While the tizzy continues around the Golden Arches' comeback, here's a look at some other fast-food chains that sell chicken wraps.

Need a break? Play the USA TODAY Daily Crossword Puzzle.

Burger King BK Royal Crispy Wraps

Burger King entered the wrap game in 2023 with the introduction of its BK Royal Crispy Wraps, according to a 2023 news release from the chain.

The wraps feature crispy white meat chicken, tomato, lettuce and one of the three flavors in a soft tortilla.

Flavors: Classic , Spicy and Honey Mustard .

, and . Cost: $2.99

Popeyes Chicken Wraps

Popeyes announced on June 2 it was introducing Chicken Wraps to its menu for a limited time, giving customers the ""craveable flavor of Popeyes, now wrapped and ready to go wherever you do,"" according to a news release.

The wraps feature Popeyes hand-breaded and battered chicken tenders with crispy lettuce, shredded cheese and crunchy pickles, all in a warm tortilla that's inspired by the flavor of Popeyes biscuits.

Flavors: The wraps and are available with your choice of a Classic , Spicy , or Honey Mustard spread.

, , or spread. Cost: $3.99

Popeyes is giving away a free chicken wrap with any order of $5 or more from July 10 through Sunday, July 13.

Sonic Crispy Tender Wraps

Sonic is another chain that recently introduced chicken wraps to its menu. The company told USA TODAY on June 7 it added two new Crispy Tender Wraps to its value menu. Both contain an all-white meat, crispy tender, lettuce, tomatoes and melty cheddar cheese wrapped in a soft, flour tortilla.

Flavors: Cheesy Baja Crispy Tender Wrap and Honey Chipotle Crispy Tender Wrap

and Cost: $1.99

Sonic also told USA TODAY more wrap flavors are coming later this year.

Taco Bell crispy chicken tacos and burritos (AKA wraps)

Earlier this summer, Taco Bell debuted a new lineup of crispy chicken menu items that include tacos and burritos after a successful trial with chicken nuggets.

The lineup of new items is available for a limited time and includes:

Crispy Chicken Taco ($2.79): One Crispy Chicken Strip layered with purple cabbage, lettuce, pico de gallo and shredded cheddar cheese with the choice of an all-new Spicy Ranchero Sauce or Avocado Ranch Sauce.

One Crispy Chicken Strip layered with purple cabbage, lettuce, pico de gallo and shredded cheddar cheese with the choice of an all-new Spicy Ranchero Sauce or Avocado Ranch Sauce. Crispy Chicken Burrito ($5.49): A full-sized burrito that features two Crispy Chicken Strips surrounded by a bed of purple cabbage, lettuce, pico de gallo, cheddar cheese and the choice of an all-new Spicy Ranchero Sauce or Avocado Ranch Sauce.

The chain said in a news release that ""crispy chicken is the future"" and is set to land on Taco Bell menus permanently in 2026.

Wendy's Wrap Duos

According to its online menu, Wendy's also offers a chicken wrap, available in three different varieties.

Customers can choose between a grilled chicken, spicy chicken or classic chicken wrap duo.

In addition to the chicken, the Wendy's Wrap Duo also features lettuce, shredded cheese, ranch and flour tortillas. Each order comes with two wraps.

Gabe Hauari is a national trending news reporter at USA TODAY. You can follow him on X @GabeHauari or email him at Gdhauari@gannett.com."
Taco Bell bringing Live Más Cafe to Houston!,06/30/2025,2025-07-17 13:43:59.926109,https://www.khou.com/article/life/food/taco-bell-live-mas-cafe-houston/285-8515aa94-1948-4b55-96a3-77b38024a310,"Taco Bell is branching out with new refreshing drinks and hopes of reaching its $5 billion beverage goal.
HOUSTON — Taco Bell has announced that its Live Más Café experience will arrive in Houston locations by fall 2025.
The Live Más Café concept, first tested in Chula Vista, California, brings a barista-style drink experience to Taco Bell restaurants.
The desire to enter the fast-food beverage scene stems from ""Gen Z's love of customization,"" Taco Bell says.
In the meantime, fans nationwide can sample the Refrescas—a new line of drinks now available at Taco Bell restaurants across the U.S.","['menu', 'bringing', 'live', 'refrescas', 'bell', 'cafe', 'houston', 'drinks', 'restaurants', 'strawberry', 'drink', 'taco', 'más', 'beverage']","Taco Bell is branching out with new refreshing drinks and hopes of reaching its $5 billion beverage goal.

HOUSTON — Taco Bell has announced that its Live Más Café experience will arrive in Houston locations by fall 2025. The move is part of the brand’s ambitious goal to reach $5 billion in beverage sales by 2030.

The Live Más Café concept, first tested in Chula Vista, California, brings a barista-style drink experience to Taco Bell restaurants. Trained “Bellristas” serve up more than 30 handcrafted beverages, including creations like Churro Chillers and Dirty Baja Blasts.

The desire to enter the fast-food beverage scene stems from ""Gen Z's love of customization,"" Taco Bell says. They are bringing the cafe expansion to existing restaurants in Southern California, Dallas, and Houston over the next year.

In the meantime, fans nationwide can sample the Refrescas—a new line of drinks now available at Taco Bell restaurants across the U.S. The Refrescas menu features six unique beverages with different fruity flavors.

The Refrescas menu includes:

Agua Refrescas ($3.99; 20oz): Flavors include Strawberry Passionfruit, Dragonfruit Berry, and Mango Peach. The drink is made with freeze-dried fruit and green tea with a caffeine boost of 52mg.

Rockstar Energy® Refrescas ($4.49; 20oz): The drink comes in two flavors, Pineapple Lime and Tropical Punch. They're high-energy drinks with 200mg of caffeine.

Refresca Freeze ($3.79/$3.99; 16oz/20oz): A frozen version of the Refresca drinks, available in Strawberry Lime, also made with real fruit pieces."
"Taco Bell announces major change to their menu this Summer, sparks buzz among fast food fans nationwide",07/15/2025,2025-07-17 13:43:59.926109,https://www.livemint.com/news/us-news/taco-bell-announces-major-change-to-their-menu-this-summer-sparks-buzz-among-fast-food-fans-nationwide-11752598214476.html,"Taco Bell is refreshing its summer offerings with a significant update to its beverage menu, introducing six new non-alcoholic drinks—branded as ""mocktails""—to locations across the United States.
New Mocktail Lineup Agua Refrescas These drinks blend real freeze-dried fruit pieces with green tea, delivering a mild caffeine boost of 52 mg per 20 oz.
Rockstar Energy Refrescas Developed in collaboration with Rockstar Energy, these bold drinks provide a high-energy hit with 200 mg of caffeine per 20 oz.
Refresca Freeze This frozen option features real fruit pieces and comes in one flavour, Strawberry Lime.
for $3.79 and 20 oz.","['lineup', 'sparks', 'mg', '20', 'refreshing', 'fruit', 'nationwide', 'fans', 'taco', 'food', 'real', 'refrescas', 'fast', 'change', 'oz', 'summer', 'menu', 'major', 'pieces', 'energy']","Taco Bell is refreshing its summer offerings with a significant update to its beverage menu, introducing six new non-alcoholic drinks—branded as ""mocktails""—to locations across the United States.

The fast food chain has also announced plans to expand its Live Más Café concept, with 30 new cafés being integrated into existing restaurants in the coming months.

The newly launched Refrescas drink lineup features a mix of energising options and cooling frozen treats designed to cater to a variety of tastes and energy needs.

New Mocktail Lineup Agua Refrescas These drinks blend real freeze-dried fruit pieces with green tea, delivering a mild caffeine boost of 52 mg per 20 oz. serving. They are available in three fruity flavours:

Strawberry Passionfruit

Dragonfruit Berry

Mango Peach

Each is priced at $3.99.

Rockstar Energy Refrescas Developed in collaboration with Rockstar Energy, these bold drinks provide a high-energy hit with 200 mg of caffeine per 20 oz. They come in two tropical flavours:

Pineapple Lime

Tropical Punch

Priced at $4.49, they aim to appeal to customers looking for a more powerful energy boost.

Refresca Freeze This frozen option features real fruit pieces and comes in one flavour, Strawberry Lime. Available in two sizes—16 oz. for $3.79 and 20 oz. for $3.99—it offers a refreshing chilled alternative to traditional sodas."
Review: Taco Bell's Crispy Chicken Strips Aren't As Good As The Nuggets,06/17/2025,2025-07-17 13:43:59.926109,https://www.tastingtable.com/1889002/taco-bell-crispy-chicken-new-items-review/,"The Crispy Chicken Burrito has the same ingredients as the taco version, though it comes in a much larger wrapping.
Inside the burrito, I noticed at least two crispy chicken strips, so this one obviously had more chicken than the taco.
Nutritionally, you're looking at 500 calories, 20 grams of fat, 1,310 milligrams of sodium, 58 grams of carbs, and 23 grams of protein in a Spicy Ranchero Crispy Chicken Burrito.
Here, it did the same thing it's always done and definitely provided a more enjoyable eating experience than the taco.
I also wasn't very impressed with the chicken strips' size.","['nuggets', 'youre', 'crispy', 'good', 'bells', 'arent', 'review', 'burrito', 'sauce', 'strips', 'spicy', 'ways', 'taco', 'chicken', 'grams']","The Crispy Chicken Burrito has the same ingredients as the taco version, though it comes in a much larger wrapping. I opted to get mine grilled to make everything melt together a little bit more, but this is one of the ways you can ""make it your own,"" as Taco Bell says, and not the default way that the burrito would come. Inside the burrito, I noticed at least two crispy chicken strips, so this one obviously had more chicken than the taco. Nutritionally, you're looking at 500 calories, 20 grams of fat, 1,310 milligrams of sodium, 58 grams of carbs, and 23 grams of protein in a Spicy Ranchero Crispy Chicken Burrito.

If you've never had an item pressed and grilled at Taco Bell, you don't know what you're missing. It makes everything so much more cohesive and melted together, and it's definitely one of my favorite ways to get burritos. Here, it did the same thing it's always done and definitely provided a more enjoyable eating experience than the taco. However, the same issue continued to persist with that Spicy Ranchero Sauce, overpowering pretty much any other flavor I would get from the burrito. Since the sauce is very thick, it doesn't really spread throughout the burrito; instead, you need a good amount to cover everything, so it ends up feeling pretty over-sauced in parts. I also wasn't very impressed with the chicken strips' size. I expected them to be quite a bit larger, but they really just seemed to be slightly bigger nuggets."
MSN,,2025-07-17 13:43:59.926109,https://www.msn.com/en-us/foodanddrink/foodnews/taco-bell-announces-major-menu-change-this-fall/ar-AA1IpZRh,,['msn'],
Taco Bell tests Luxe Value Menu with $3 or less items,07/17/2025,2025-07-17 13:43:59.926109,https://www.qsrweb.com/news/taco-bell-tests-luxe-value-menu-with-3-or-less-items/,"Taco Bell tests Luxe Value Menu with $3 or less itemsPhoto: Taco BellJuly 17, 2025Taco Bell is testing its Luxe Value Menu, which has items priced at $3 or less, in its Indianapolis market.
— Grilled all-white-meat chicken, double sauces (Avocado Ranch Sauce plus creamy Chipotle Sauce), three-cheese blend, lettuce and tomatoes all folded into Taco Bell's signature Stacker format.
Beefy Potato Loaded Griller — A grilled roll-up filled with seasoned beef, crispy potato bites, Nacho Cheese Sauce, Chipotle Sauce, and reduced-fat sour cream.
— A grilled roll-up filled with seasoned beef, crispy potato bites, Nacho Cheese Sauce, Chipotle Sauce, and reduced-fat sour cream.
— Layers of seasoned beef, beans, Nacho Cheese Sauce, reduced-fat sour cream, pico de gallo, and a three-cheese blend served with tortilla chips.","['beef', 'threecheese', 'tortilla', 'menu', 'value', 'bell', 'chipotle', 'sauce', 'seasoned', 'items', 'cheese', 'luxe', 'taco', 'tomatoes', 'tests', 'nacho']","Taco Bell tests Luxe Value Menu with $3 or less items

Photo: Taco Bell

July 17, 2025

Taco Bell is testing its Luxe Value Menu, which has items priced at $3 or less, in its Indianapolis market. The menu is available for a limited time only, according to a press release.

The lineup features five premium items:

Mini Taco Salad — A new take on a classic, featuring seasoned beef, Chipotle Sauce, cheddar cheese, lettuce, tomatoes, and refried beans in a crispy, golden tortilla bowl.

— A new take on a classic, featuring seasoned beef, Chipotle Sauce, cheddar cheese, lettuce, tomatoes, and refried beans in a crispy, golden tortilla bowl. Chipotle Ranch Chicken Stacker — Grilled all-white-meat chicken, double sauces (Avocado Ranch Sauce plus creamy Chipotle Sauce), three-cheese blend, lettuce and tomatoes all folded into Taco Bell's signature Stacker format.

— Grilled all-white-meat chicken, double sauces (Avocado Ranch Sauce plus creamy Chipotle Sauce), three-cheese blend, lettuce and tomatoes all folded into Taco Bell's signature Stacker format. Beefy Potato Loaded Griller — A grilled roll-up filled with seasoned beef, crispy potato bites, Nacho Cheese Sauce, Chipotle Sauce, and reduced-fat sour cream.

— A grilled roll-up filled with seasoned beef, crispy potato bites, Nacho Cheese Sauce, Chipotle Sauce, and reduced-fat sour cream. Chips & Nacho Supreme Dip — Layers of seasoned beef, beans, Nacho Cheese Sauce, reduced-fat sour cream, pico de gallo, and a three-cheese blend served with tortilla chips.

— Layers of seasoned beef, beans, Nacho Cheese Sauce, reduced-fat sour cream, pico de gallo, and a three-cheese blend served with tortilla chips. Salted Caramel Churros — Crispy-on-the-outside, creamy-on-the-inside, churros dusted in salted caramel sugar.

These additions will be available alongside existing favorites, including the Cheesy Roll Up, Spicy Potato Soft Taco, Cheesy Bean & Rice Burrito, Three-Cheese Chicken Flatbread and the Cheesy Double Beef Burrito."
