title,pubdate,date_collected,url,summary,keywords,FullText
"TACO BELL® TESTS NEW LUXE VALUE MENU: BIG FLAVOR, BOLD VALUE, INNOVATION THAT HITS",,2025-07-17 13:43:59.926109,https://www.prnewswire.com/news-releases/taco-bell-tests-new-luxe-value-menu-big-flavor-bold-value-innovation-that-hits-302507381.html,"Designed to bring elevated flavors and formats to everyday value, the Luxe Value Menu test delivers indulgent innovation.
Beefy Potato Loaded Griller – A grilled roll-up filled with seasoned beef, crispy potato bites, Nacho Cheese Sauce, Chipotle Sauce, and reduced-fat sour cream.
– A grilled roll-up filled with seasoned beef, crispy potato bites, Nacho Cheese Sauce, Chipotle Sauce, and reduced-fat sour cream.
Now, the Luxe Value Menu takes that mission even further — bringing bold, everyday indulgence to the $3-and-under crowd.
Jacqueline Cisneros – Taco Bell Corp.[email protected]Katie Snyder - Edelman[email protected]SOURCE Taco Bell Corp.","['menu', 'value', 'innovation', 'bell', 'chipotle', 'sauce', 'premium', 'flavor', 'hits', 'bold', 'craveable', 'luxe', 'taco', 'test', 'tests', 'big']","Taco Bell is testing a new Luxe Value Menu that is anything but basic – featuring five bold, elevated items alongside existing fan favorites — all for $3 or less. Think premium flavors, irresistible formats, and no compromise on crave

TLDR:

Taco Bell is redefining value with the new Luxe Value Menu test in Indianapolis , offering a craveable lineup of premium innovations and classic fan favorites all priced at $3 or less each.

, offering a craveable lineup of premium innovations and classic fan favorites all priced at or less each. The test menu features five craveable items, including the Mini Taco Salad, Chipotle Ranch Chicken Stacker, Beefy Potato Loaded Griller, Chips & Nacho Supreme Dip, and Salted Caramel Churros. These items are available alongside existing favorites, including the Cheesy Roll Up, Spicy Potato Soft Taco, Cheesy Bean & Rice Burrito, Three-Cheese Chicken Flatbread and the Cheesy Double Beef Burrito.

Designed to bring elevated flavors and formats to everyday value, the Luxe Value Menu test delivers indulgent innovation.

Luxe Value Menu test assets can be found here.

IRVINE, Calif., July 17, 2025 /PRNewswire/ -- Taco Bell fans in Indianapolis, IN are getting an exclusive first taste as the brand tests the new Luxe Value Menu — a craveable lineup of premium innovations, all priced at $3 or less each. This bold take on value is available for a limited time at select locations in the Indianapolis area.

Taco Bell is redefining value with the new Luxe Value Menu test in Indianapolis, offering a craveable lineup of premium innovations and classic fan favorites all priced at $3 or less each.

An evolution of the beloved Cravings Value Menu, this flavor forward, fan fueled test lineup features five premium items: Mini Taco Salad, Chipotle Ranch Chicken Stacker, Beefy Potato Loaded Griller, Chips & Nacho Supreme Dip and Salted Caramel Churros. These new additions will be available alongside existing favorites, including the Cheesy Roll Up, Spicy Potato Soft Taco, Cheesy Bean & Rice Burrito, Three-Cheese Chicken Flatbread and the Cheesy Double Beef Burrito.

The menu will be available at select locations across the Indianapolis area starting July 17th, while supplies last.

Bold Flavors, No Compromises

The Luxe Value Menu is where bold meets everyday. Creations like the Mini Taco Salad — first teased at Live Más LIVE — deliver premium flavors and craveable formats made accessible. It's value without compromise: bold, unexpected, and unmistakably Taco Bell.

From handheld stacks to indulgent dips, the Luxe Value Menu test is built to satisfy every craving — and proves fans can have it all: flavor, variety, innovation, and value. All for three bucks or less.

Luxe for Every Craving

The Luxe Value Menu features five craveable items — including a brand-new innovation debut.

Mini Taco Salad – A new take on a classic, featuring seasoned beef, Chipotle Sauce, cheddar cheese, lettuce, tomatoes, and refried beans in a crispy, golden tortilla bowl.

– A new take on a classic, featuring seasoned beef, Chipotle Sauce, cheddar cheese, lettuce, tomatoes, and refried beans in a crispy, golden tortilla bowl. Chipotle Ranch Chicken Stacker – Grilled all-white-meat chicken, double sauces (Avocado Ranch Sauce + creamy Chipotle Sauce), three-cheese blend, lettuce, and tomatoes all folded into Taco Bell's signature Stacker format.

– Grilled all-white-meat chicken, double sauces (Avocado Ranch Sauce + creamy Chipotle Sauce), three-cheese blend, lettuce, and tomatoes all folded into Taco Bell's signature Stacker format. Beefy Potato Loaded Griller – A grilled roll-up filled with seasoned beef, crispy potato bites, Nacho Cheese Sauce, Chipotle Sauce, and reduced-fat sour cream.

– A grilled roll-up filled with seasoned beef, crispy potato bites, Nacho Cheese Sauce, Chipotle Sauce, and reduced-fat sour cream. Chips & Nacho Supreme Dip – Layers of seasoned beef, beans, Nacho Cheese Sauce, reduced-fat sour cream, pico de gallo, and a three-cheese blend — served with tortilla chips for scoopable satisfaction.

– Layers of seasoned beef, beans, Nacho Cheese Sauce, reduced-fat sour cream, pico de gallo, and a three-cheese blend — served with tortilla chips for scoopable satisfaction. Salted Caramel Churros – Crispy-on-the-outside, creamy-on-the-inside, churros dusted in salted caramel sugar for a street-food-inspired dessert moment.

Building a Value Legacy

The Luxe Value Menu test is a natural extension of Taco Bell's evolving value story and commitment to providing accessible options for all lifestyles and cravings. Since its value-forward roots, Taco Bell continues to deliver premium menu items at every price point.

Alongside the original Cravings Value Menu, currently available nationwide, this new lineup lets Taco Bell innovate to meet fans where they are. Now, the Luxe Value Menu takes that mission even further — bringing bold, everyday indulgence to the $3-and-under crowd.

About Taco Bell Corp.

For more than 62 years, Taco Bell has brought innovative, craveable Mexican-inspired food to the masses, and was recently recognized as one of Fast Company's World's Most Innovative Companies, one of TIME's Most Influential Companies, and Nation's Restaurant News' Brand Icon. For more information about Taco Bell, visit our website at www.TacoBell.com, our Newsroom at www.TacoBell.com/news, or check out www.TacoBell.com/popular-links. You can also stay up to date on all things Taco Bell by following us on LinkedIn, TikTok, X, Instagram, Facebook and by subscribing to our YouTube channel.

Jacqueline Cisneros – Taco Bell Corp.

[email protected]



Katie Snyder - Edelman

[email protected]



SOURCE Taco Bell Corp."
Taco Bell Just Announced 6 Wild New Items,07/17/2025,2025-07-17 13:43:59.926109,https://www.eatthis.com/taco-bell-announces-six-new-menu-items/,"Taco Bell‘s recent menu offerings have been truly impressive: From the Crispy Chicken Nuggets to the Luxe Cravings Boxes and one of the best Crispy Chicken Burritos in the game, the chain is on fire this year.
Not content to just ride on that very successful wave, Taco Bell just announced a new Luxe Value Menu which contains five premium elevated items, all priced at $3 or less each, plus an exciting new dip.
Mini Taco SaladThe new Mini Taco Salad was first introduced during the Taco Bell Live Más LIVE event, and is now part of the new Luxe Value Menu.
This smoky-sweet menu item is the perfect pairing for the Crispy Chicken Tacos, Burritos and Strips.
“It’s very similar to the Chipotle Ranch Chicken Burrito (also grilled), which most people lament the loss of to this day,” one Redditor said.","['ranch', 'menu', 'crispy', 'bell', 'wild', 'sauce', 'chipotle', 'announced', 'items', 'fans', 'taco', 'chicken', 'nacho']","Taco Bell‘s recent menu offerings have been truly impressive: From the Crispy Chicken Nuggets to the Luxe Cravings Boxes and one of the best Crispy Chicken Burritos in the game, the chain is on fire this year. Not content to just ride on that very successful wave, Taco Bell just announced a new Luxe Value Menu which contains five premium elevated items, all priced at $3 or less each, plus an exciting new dip. This new test menu will be available at select locations in Indianapolis starting July 17th, while supplies last. Here’s what fans need to know about the limited time-only new menu.

Mini Taco Salad

The new Mini Taco Salad was first introduced during the Taco Bell Live Más LIVE event, and is now part of the new Luxe Value Menu. The Taco Salad is made with seasoned beef, Chipotle Sauce, and cheddar cheese, and fans who saw the item being teased at Live Más were sure it was too good to be true. It’s very real, and hopefully will make it to the permanent menu at some point.

Sweet Chipotle BBQ Sauce

Taco Bell’s new Sweet Chipotle BBQ sauce is available nationwide starting July 17, for a limited time only. This smoky-sweet menu item is the perfect pairing for the Crispy Chicken Tacos, Burritos and Strips. “BBQ ranks among the most-loved dipping sauces in the crispy chicken space, and while Taco Bell has dabbled in the BBQ world before, this version brings a fresh, Taco Bell-style Twist,” the chain says.6254a4d1642c605c54bf1cab17d50f1e

Chipotle Ranch Chicken Stacker

The Chipotle Ranch Chicken Stacker is made with grilled all-white-meat chicken, Avocado Ranch Sauce + creamy Chipotle Sauce, shredded three-cheese blend, lettuce, and tomatoes, all folded into the Stacker format. “It’s very similar to the Chipotle Ranch Chicken Burrito (also grilled), which most people lament the loss of to this day,” one Redditor said.

7 Reasons Taco Bell Is Crushing Every Other Fast Food Chain Right Now

Beefy Potato Loaded Griller

The Beefy Potato Loaded Griller was previously tested and now it’s back—so fans who were begging for its return will be very happy. “Bring back the Loaded Grillers!” one Redditor said. “Tell me these weren’t the best??!!!!! Did anyone else get the chance to taste greatness? Especially the chicken one with the spicy sauce 🤤. The beefy nacho was also great and the closest thing to that is the ‘Cheesy double beef burrito’and my only complaint about it is that they DON’T grill the burrito!!!!!!! 🌯”

Chips & Nacho Supreme Dip

Another brand new item, the Chips & Nacho Supreme Dip is made with layers of seasoned beef, beans, Nacho Cheese Sauce, reduced-fat sour cream, pico de gallo, and a three-cheese blend, served with Taco Bell tortilla chips. “Looks yummy. I’m gonna make one my next day at work!!” one employee said.

Salted Caramel Churros

Also new to the menu are the Salted Caramel Churros, a “crispy-on-the-outside, creamy-on-the-inside” churro treat, dusted in salted caramel sugar. This street food-inspired dessert is sure to be a hit with fans who are obsessed with the Milk Bar Birthday Cake Churros."
Taco Bell tests value menu in Indianapolis,07/17/2025,2025-07-17 13:43:59.926109,https://www.restaurantdive.com/news/taco-bell-3-dollar-luxe-value-menu-indianapolis-churros/753258/,"The lineup, called the Luxe Value Menu, consists of the following five items: Mini Taco Salad, Chipotle Ranch Chicken Stacker, Beefy Potato Loaded Griller, Chips & Nacho Supreme Dip, and Salted Caramel Churros.
These are slightly more premium versions of existing or former menu items, all priced at $3 or below, and are available alongside existing value items according to the press release.","['versions', 'salted', 'menu', 'value', 'existing', 'stacker', 'bell', 'indianapolis', 'slightly', 'supreme', 'items', 'taco', 'tests']","The lineup, called the Luxe Value Menu, consists of the following five items: Mini Taco Salad, Chipotle Ranch Chicken Stacker, Beefy Potato Loaded Griller, Chips & Nacho Supreme Dip, and Salted Caramel Churros. These are slightly more premium versions of existing or former menu items, all priced at $3 or below, and are available alongside existing value items according to the press release."
Taco Bell is testing a Luxe Value Menu with items for $3 or less,,2025-07-17 13:43:59.926109,https://www.nrn.com/quick-service/taco-bell-is-testing-a-luxe-value-menu-lineup-with-items-for-3-or-less,"Now, Taco Bell is testing whether it can go even lower than its Luxe Box value proposition.
A Luxe Value Menu is now in market in Indianapolis, Ind., offering a lineup of items priced at $3 or less.
Related:Signature: An exclusive interview with Dutch Bros CEO Christine BaroneIn a press release, the company said the Luxe Value Menu test is a “natural extension” of Taco Bell’s evolving value positioning.
New Sweet Chipotle BBQ SauceAdditionally, Taco Bell continues to ramp up its Crispy Chicken offerings by introducing a complementary sweet chipotle BBQ sauce, available starting today for a limited time.
Related:McDonald’s Snack Wrap comes out of the gate hotSince the introduction of Crispy Chicken Tacos and Burritos in June and the return of the Crispy Chicken Nuggets in April, Crispy Chicken products now appear in one out of every 10 orders.","['menu', 'value', 'crispy', 'bell', 'chipotle', 'sauce', 'bbq', 'sweet', 'items', 'luxe', 'taco', 'testing', 'chicken', 'nacho']","As the quick-service segment continues to jockey for value consumers in a bid to gain back traffic losses, one brand has emerged as a clear winner — Taco Bell. The evidence is in its 9% same-store sales growth in the first quarter, driven in part by traffic growth from continued menu innovation such as the new Crunchwrap Sliders, Crispy Chicken Nuggets, Caliente Cantina Chicken, and the expansion of its Luxe Box offerings to include $5, $7, and $9 options.

Now, Taco Bell is testing whether it can go even lower than its Luxe Box value proposition. A Luxe Value Menu is now in market in Indianapolis, Ind., offering a lineup of items priced at $3 or less.

The test menu features a new Mini Taco Salad, Chipotle Ranch Chicken Stacker, Beefy Potato Loaded Griller, Chips & Nacho Supreme Dip, and Salted Caramel Churros. These items are available alongside existing favorites, including the Cheesy Roll Up, Spicy Potato Soft Taco, Cheesy Bean & Rice Burrito, Three-Cheese Chicken Flatbread and the Cheesy Double Beef Burrito.

The menu, detailed below, is available at select locations across the Indianapolis area starting today while supplies last.

The Mini Taco Salad — first teased at the Live Más Live event in March in New York City — is a new take on a classic item, with seasoned beef, chipotle sauce, cheddar cheese, lettuce, tomatoes, and refried beans in a crispy tortilla bowl.

Chipotle Ranch Chicken Stacker includes grilled all-white-meat chicken, double sauces (avocado ranch and creamy chipotle), three-cheese blend, lettuce, and tomatoes folded into Taco Bell’s signature Stacker format.

Beefy Potato Loaded Griller is a grilled roll-up filled with seasoned beef, crispy potato bites, nacho cheese sauce, chipotle sauce, and reduced-fat sour cream

Chips & Nacho Supreme Dip includes layers of seasoned beef, beans, nacho cheese sauce, reduced-fat sour cream, pico de gallo, and a three-cheese blend, and is served with tortilla chips.

Salted Caramel Churros are churros dusted in salted caramel sugar and are inspired by street-food desserts.

Related:Signature: An exclusive interview with Dutch Bros CEO Christine Barone

In a press release, the company said the Luxe Value Menu test is a “natural extension” of Taco Bell’s evolving value positioning. The Cravings Value Menu remains available nationwide.

New Sweet Chipotle BBQ Sauce

Additionally, Taco Bell continues to ramp up its Crispy Chicken offerings by introducing a complementary sweet chipotle BBQ sauce, available starting today for a limited time. The sauce balances smoky chipotle peppers, molasses, and spices, according to the company, and pairs well with tortilla chip-coated Crispy Chicken Tacos, Burritos, and Strips.

Related:McDonald’s Snack Wrap comes out of the gate hot

Since the introduction of Crispy Chicken Tacos and Burritos in June and the return of the Crispy Chicken Nuggets in April, Crispy Chicken products now appear in one out of every 10 orders. Taco Bell has called Crispy Chicken “the future,” adding that it will be a permanent menu platform in 2026. Sauces have complemented the offerings, with more than 20 million sauces sold since the April relaunch.

The Sweet Chipotle BBQ Lineup includes:

• Crispy Chicken Taco featuring spicy ranch and sweet chipotle BBQ sauce, $2.79

• Crispy Chicken Burrito featuring spicy ranch and sweet chipotle BBQ sauce, $5.49

• Sweet Chipotle BBQ Sauce Topped Nacho Fries: Nacho Fries topped with slow-roasted chicken, a drizzling of nacho cheese sauce, spicy ranch, sweet chipotle BBQ sauce, cheddar cheese, and jalapeños, $4.99

Guests can also add sweet chipotle BBQ sauce to any item for 30 cents or on the side in a souffle cup for 60 cents.

Contact Alicia Kelso at [email protected]"
Two Louisville fast food restaurants make the 2025 USA Today 10Best Readers' Choice list,07/16/2025,2025-07-17 13:43:59.926109,https://www.courier-journal.com/story/life/food/2025/07/16/taco-bell-kfc-named-10best-readers-choice-list-in-usa-today-2025/85206726007/,"AI-assisted summary Yum Brands chains KFC and Taco Bell ranked 6th and 7th on USA TODAY 10Best Readers’ Choice Awards for best fast food restaurants.
Taco Bell's Nacho Cheese Doritos Locos Taco was voted 10th best fast food taco.
Louisville-based Yum Brands has two of the top 10 best fast food restaurants in the country and the best fast casual food chain, according to USA TODAY 10Best Readers Choice Awards.
7 among the best fast food restaurants in the country overall, according to the awards.
The burger joint, which is known its chef-driven award winning menu, won best fast food burger and best fast food side for its tempura green beans.","['2025', 'yum', 'taco', 'louisville', 'grill', 'fast', 'choice', 'burger', 'voted', 'readers', 'restaurants', 'usa', 'best', 'food', 'brands', 'today', 'list']","AI-assisted summary Yum Brands chains KFC and Taco Bell ranked 6th and 7th on USA TODAY 10Best Readers’ Choice Awards for best fast food restaurants.

Habit Burger and Grill, also owned by Yum Brands, was voted the best fast casual restaurant.

KFC also earned recognition for its fried chicken, fries, and mashed potatoes and gravy.

Taco Bell's Nacho Cheese Doritos Locos Taco was voted 10th best fast food taco.

Voters have spoken! Louisville-based Yum Brands has two of the top 10 best fast food restaurants in the country and the best fast casual food chain, according to USA TODAY 10Best Readers Choice Awards.

Kentucky Fried Chicken and Taco Bell were voted the No. 6 and No. 7 among the best fast food restaurants in the country overall, according to the awards.

Yum's Habit Burger and Grill, which does not have locations in Kentucky and operates predominantly along the east and west coasts, was named the No. 1 best fast casual restaurant in the country.

The three chains fall under the Yum Brands umbrella and collectively took home nine accolades in the reader-driven awards, which highlight the nation's best in travel, food and drink, and lifestyle.

Need a break? Play the USA TODAY Daily Crossword Puzzle.

KFC was named the No. 8 best restaurant in the country for fast food fried chicken and No. 10 best for fast food fries. KFC's mashed potatoes and gravy were chosen as the No. 8 best fast food side dish.

Readers picked Taco Bell's Nacho Cheese Doritos Locos Taco as the No. 10 best fast food taco.

Habit Burger and Grill took home two other No. 1 wins. The burger joint, which is known its chef-driven award winning menu, won best fast food burger and best fast food side for its tempura green beans.

Yum Brands, which also owns Pizza Hut, operates more than 61,000 restaurants across 155 countries and territories. The company is a Fortune 500 company that has been based in Louisville since 1997. The four brands have more than one million employees and franchise team members.

Taco Bell, KFC and Habit Burger and Grill were initially nominated by a group of industry experts. 10BEST editors then vet these nominations and select a final set of nominees to be presented to the voting public for a period of four weeks.

Reach Courier Journal reporter Maggie Menderski at mmenderski@courier-journal.com.

This story was updated to add a gallery."
